<?xml version="1.0" encoding="UTF-8"?>
<getrockets-response xmlns="http://www.thrustcurve.org/2015/GetRocketsResponse" xmlns:xsi="http://www.w3.org/2001/XMLSchema-instance" xsi:schemaLocation="http://www.thrustcurve.org/2015/GetRocketsResponse http://www.thrustcurve.org/2015/getrockets-response.xsd">
    <results>
        <rocket>
            <id>100000x</id>
            <name>Alpha III</name>
            <body-diameter-m>0.024891999999999997</body-diameter-m>
            <mmt-diameter-mm>18</mmt-diameter-mm>
            <mmt-length-mm>76.2</mmt-length-mm>
            <weight-kg>0.0340194</weight-kg>
            <cd>0.4</cd>
            <guide-length-m>0.9144000000000001</guide-length-m>
            <website>https://estesrockets.com/product/001256-alpha-iii/</website>
            <comments>This is my first rocket; I'm very proud!</comments>
            <created-on>2020-09-27</created-on>
            <updated-on>2020-09-27</updated-on>
        </rocket>
        <rocket>
            <id>100000x</id>
            <name>Versatile</name>
            <body-diameter-m>0.033782</body-diameter-m>
            <mmt-diameter-mm>24</mmt-diameter-mm>
            <mmt-length-mm>152.4</mmt-length-mm>
            <weight-kg>0.0850485</weight-kg>
            <cd>0.45</cd>
            <guide-length-m>0.9144000000000001</guide-length-m>
            <comments>Can adapt down to 18mm</comments>
            <created-on>2020-09-27</created-on>
            <updated-on>2020-09-27</updated-on>
        </rocket>
    </results>
</getrockets-response>